{
  "$schema": "http://json-schema.org/draft-07/schema#",
  "$id": "https://agent-os.dev/schemas/tool.json",
  "title": "Tool Specification",
  "description": "Schema for defining a Tool in Agent OS",
  "type": "object",
  "required": ["id", "name", "version", "type"],
  "properties": {
    "id": {
      "type": "string",
      "pattern": "^[a-z0-9-]+$",
      "description": "Unique identifier for the tool"
    },
    "name": {
      "type": "string",
      "description": "Human-readable name"
    },
    "version": {
      "type": "string",
      "pattern": "^\\d+\\.\\d+\\.\\d+$",
      "description": "Semantic version"
    },
    "type": {
      "type": "string",
      "enum": ["function", "api", "mcp"],
      "description": "Tool type"
    },
    "description": {
      "type": "string",
      "description": "Tool description"
    },
    "parameters": {
      "type": "object",
      "description": "JSON Schema for tool parameters"
    },
    "returns": {
      "type": "object",
      "description": "JSON Schema for return value"
    }
  }
}
