{
  "id": "echo-tool",
  "name": "Echo Tool",
  "version": "1.0.0",
  "type": "function",
  "description": "A simple tool that echoes back the input",
  "parameters": {
    "type": "object",
    "properties": {
      "message": {
        "type": "string",
        "description": "The message to echo"
      }
    },
    "required": ["message"]
  },
  "returns": {
    "type": "object",
    "properties": {
      "echo": {
        "type": "string"
      }
    }
  }
}
